"DESCRIPTION","DURATION IN MS","NAME","PARENT SUITE","START TIME","STATUS","STOP TIME","SUB SUITE","SUITE","TEST CLASS","TEST METHOD"
"","1030","Deve preencher o formulário com sucesso","Testes End to end - QA Playground","Wed Apr 09 20:35:53 UTC 2025","passed","Wed Apr 09 20:35:54 UTC 2025","","","",""
"","469","Deve exibir mensagem de erro quando não preencher o campo e-mail","Testes End to end - QA Playground","Wed Apr 09 20:35:56 UTC 2025","passed","Wed Apr 09 20:35:57 UTC 2025","","","",""
"","706","Deve exibir mensagem de erro quando preencher e-mail com formato inválido","Testes End to end - QA Playground","Wed Apr 09 20:35:58 UTC 2025","passed","Wed Apr 09 20:35:59 UTC 2025","","","",""
"","150","Deve ativar e validar o modo de alto contraste","Testes End to end - QA Playground","Wed Apr 09 20:36:00 UTC 2025","passed","Wed Apr 09 20:36:00 UTC 2025","","","",""
"","588","Deve exibir mensagem de erro quando não preencher o campo nome","Testes End to end - QA Playground","Wed Apr 09 20:35:55 UTC 2025","passed","Wed Apr 09 20:35:55 UTC 2025","","","",""
"","604","Deve exibir mensagem de erro quando não preencher o campo Idade","Testes End to end - QA Playground","Wed Apr 09 20:35:57 UTC 2025","passed","Wed Apr 09 20:35:58 UTC 2025","","","",""
